[
  {
    "schema_version": "oracle/v1",
    "suite": "financial_statements",
    "status": "frozen",
    "basis": "as_reported",
    "frozen_at": "2026-09-03T11:15:43Z",
    "point_in_time": {
      "information_available_at": "2026-06-10T06:02:59Z",
      "source_published_at": "2026-06-10T06:02:59Z",
      "retrieved_at": "2026-09-03T09:28:10Z",
      "as_of": "2026-03-31T23:59:59Z"
    },
    "evidence": {
      "authoritative_receipt_id": "toyota-fy2026-sec-20f",
      "corroborating_receipt_ids": [
        "toyota-fy2026-jpx-summary"
      ]
    },
    "oracle_id": "fs-jp-toyota-7203-fy2026-income-statement",
    "case_ids": [
      "FS-070"
    ],
    "atomic_assertions": [
      {
        "assertion_id": "fs-jp-toyota-7203-fy2026-income-statement-row-01",
        "field": "consolidated_statement_of_income.sales_of_products",
        "expected": "45865949",
        "comparison": "exact_normalized",
        "currency": "JPY",
        "unit": "JPY_millions",
        "period": "FY2026 (2025-04-01 to 2026-03-31)",
        "basis": "as_reported",
        "case_ids": [
          "FS-070"
        ],
        "receipt_ids": [
          "toyota-fy2026-sec-20f",
          "toyota-fy2026-jpx-summary"
        ]
      },
      {
        "assertion_id": "fs-jp-toyota-7203-fy2026-income-statement-row-02",
        "field": "consolidated_statement_of_income.financial_services",
        "expected": "4819003",
        "comparison": "exact_normalized",
        "currency": "JPY",
        "unit": "JPY_millions",
        "period": "FY2026 (2025-04-01 to 2026-03-31)",
        "basis": "as_reported",
        "case_ids": [
          "FS-070"
        ],
        "receipt_ids": [
          "toyota-fy2026-sec-20f",
          "toyota-fy2026-jpx-summary"
        ]
      },
      {
        "assertion_id": "fs-jp-toyota-7203-fy2026-income-statement-row-03",
        "field": "consolidated_statement_of_income.total_sales_revenues",
        "expected": "50684952",
        "comparison": "exact_normalized",
        "currency": "JPY",
        "unit": "JPY_millions",
        "period": "FY2026 (2025-04-01 to 2026-03-31)",
        "basis": "as_reported",
        "case_ids": [
          "FS-070"
        ],
        "receipt_ids": [
          "toyota-fy2026-sec-20f",
          "toyota-fy2026-jpx-summary"
        ]
      },
      {
        "assertion_id": "fs-jp-toyota-7203-fy2026-income-statement-row-04",
        "field": "consolidated_statement_of_income.cost_of_products_sold",
        "expected": "39141418",
        "comparison": "exact_normalized",
        "currency": "JPY",
        "unit": "JPY_millions",
        "period": "FY2026 (2025-04-01 to 2026-03-31)",
        "basis": "as_reported",
        "case_ids": [
          "FS-070"
        ],
        "receipt_ids": [
          "toyota-fy2026-sec-20f",
          "toyota-fy2026-jpx-summary"
        ]
      },
      {
        "assertion_id": "fs-jp-toyota-7203-fy2026-income-statement-row-05",
        "field": "consolidated_statement_of_income.cost_of_financial_services",
        "expected": "3079794",
        "comparison": "exact_normalized",
        "currency": "JPY",
        "unit": "JPY_millions",
        "period": "FY2026 (2025-04-01 to 2026-03-31)",
        "basis": "as_reported",
        "case_ids": [
          "FS-070"
        ],
        "receipt_ids": [
          "toyota-fy2026-sec-20f",
          "toyota-fy2026-jpx-summary"
        ]
      },
      {
        "assertion_id": "fs-jp-toyota-7203-fy2026-income-statement-row-06",
        "field": "consolidated_statement_of_income.selling_general_and_administrative",
        "expected": "4697524",
        "comparison": "exact_normalized",
        "currency": "JPY",
        "unit": "JPY_millions",
        "period": "FY2026 (2025-04-01 to 2026-03-31)",
        "basis": "as_reported",
        "case_ids": [
          "FS-070"
        ],
        "receipt_ids": [
          "toyota-fy2026-sec-20f",
          "toyota-fy2026-jpx-summary"
        ]
      },
      {
        "assertion_id": "fs-jp-toyota-7203-fy2026-income-statement-row-07",
        "field": "consolidated_statement_of_income.total_costs_and_expenses",
        "expected": "46918736",
        "comparison": "exact_normalized",
        "currency": "JPY",
        "unit": "JPY_millions",
        "period": "FY2026 (2025-04-01 to 2026-03-31)",
        "basis": "as_reported",
        "case_ids": [
          "FS-070"
        ],
        "receipt_ids": [
          "toyota-fy2026-sec-20f",
          "toyota-fy2026-jpx-summary"
        ]
      },
      {
        "assertion_id": "fs-jp-toyota-7203-fy2026-income-statement-row-08",
        "field": "consolidated_statement_of_income.operating_income",
        "expected": "3766216",
        "comparison": "exact_normalized",
        "currency": "JPY",
        "unit": "JPY_millions",
        "period": "FY2026 (2025-04-01 to 2026-03-31)",
        "basis": "as_reported",
        "case_ids": [
          "FS-070"
        ],
        "receipt_ids": [
          "toyota-fy2026-sec-20f",
          "toyota-fy2026-jpx-summary"
        ]
      },
      {
        "assertion_id": "fs-jp-toyota-7203-fy2026-income-statement-row-09",
        "field": "consolidated_statement_of_income.share_of_profit_loss_of_investments_accounted_for_using_equity_method",
        "expected": "552742",
        "comparison": "exact_normalized",
        "currency": "JPY",
        "unit": "JPY_millions",
        "period": "FY2026 (2025-04-01 to 2026-03-31)",
        "basis": "as_reported",
        "case_ids": [
          "FS-070"
        ],
        "receipt_ids": [
          "toyota-fy2026-sec-20f",
          "toyota-fy2026-jpx-summary"
        ]
      },
      {
        "assertion_id": "fs-jp-toyota-7203-fy2026-income-statement-row-10",
        "field": "consolidated_statement_of_income.other_finance_income",
        "expected": "594243",
        "comparison": "exact_normalized",
        "currency": "JPY",
        "unit": "JPY_millions",
        "period": "FY2026 (2025-04-01 to 2026-03-31)",
        "basis": "as_reported",
        "case_ids": [
          "FS-070"
        ],
        "receipt_ids": [
          "toyota-fy2026-sec-20f",
          "toyota-fy2026-jpx-summary"
        ]
      },
      {
        "assertion_id": "fs-jp-toyota-7203-fy2026-income-statement-row-11",
        "field": "consolidated_statement_of_income.other_finance_costs",
        "expected": "-86746",
        "comparison": "exact_normalized",
        "currency": "JPY",
        "unit": "JPY_millions",
        "period": "FY2026 (2025-04-01 to 2026-03-31)",
        "basis": "as_reported",
        "case_ids": [
          "FS-070"
        ],
        "receipt_ids": [
          "toyota-fy2026-sec-20f",
          "toyota-fy2026-jpx-summary"
        ]
      },
      {
        "assertion_id": "fs-jp-toyota-7203-fy2026-income-statement-row-12",
        "field": "consolidated_statement_of_income.foreign_exchange_gain_loss_net",
        "expected": "400780",
        "comparison": "exact_normalized",
        "currency": "JPY",
        "unit": "JPY_millions",
        "period": "FY2026 (2025-04-01 to 2026-03-31)",
        "basis": "as_reported",
        "case_ids": [
          "FS-070"
        ],
        "receipt_ids": [
          "toyota-fy2026-sec-20f",
          "toyota-fy2026-jpx-summary"
        ]
      },
      {
        "assertion_id": "fs-jp-toyota-7203-fy2026-income-statement-row-13",
        "field": "consolidated_statement_of_income.other_income_loss_net",
        "expected": "-74239",
        "comparison": "exact_normalized",
        "currency": "JPY",
        "unit": "JPY_millions",
        "period": "FY2026 (2025-04-01 to 2026-03-31)",
        "basis": "as_reported",
        "case_ids": [
          "FS-070"
        ],
        "receipt_ids": [
          "toyota-fy2026-sec-20f",
          "toyota-fy2026-jpx-summary"
        ]
      },
      {
        "assertion_id": "fs-jp-toyota-7203-fy2026-income-statement-row-14",
        "field": "consolidated_statement_of_income.income_before_income_taxes",
        "expected": "5152996",
        "comparison": "exact_normalized",
        "currency": "JPY",
        "unit": "JPY_millions",
        "period": "FY2026 (2025-04-01 to 2026-03-31)",
        "basis": "as_reported",
        "case_ids": [
          "FS-070"
        ],
        "receipt_ids": [
          "toyota-fy2026-sec-20f",
          "toyota-fy2026-jpx-summary"
        ]
      },
      {
        "assertion_id": "fs-jp-toyota-7203-fy2026-income-statement-row-15",
        "field": "consolidated_statement_of_income.income_tax_expense",
        "expected": "1167234",
        "comparison": "exact_normalized",
        "currency": "JPY",
        "unit": "JPY_millions",
        "period": "FY2026 (2025-04-01 to 2026-03-31)",
        "basis": "as_reported",
        "case_ids": [
          "FS-070"
        ],
        "receipt_ids": [
          "toyota-fy2026-sec-20f",
          "toyota-fy2026-jpx-summary"
        ]
      },
      {
        "assertion_id": "fs-jp-toyota-7203-fy2026-income-statement-row-16",
        "field": "consolidated_statement_of_income.net_income",
        "expected": "3985761",
        "comparison": "exact_normalized",
        "currency": "JPY",
        "unit": "JPY_millions",
        "period": "FY2026 (2025-04-01 to 2026-03-31)",
        "basis": "as_reported",
        "case_ids": [
          "FS-070"
        ],
        "receipt_ids": [
          "toyota-fy2026-sec-20f",
          "toyota-fy2026-jpx-summary"
        ]
      },
      {
        "assertion_id": "fs-jp-toyota-7203-fy2026-income-statement-row-17",
        "field": "consolidated_statement_of_income.net_income_attributable_to_toyota_motor_corporation",
        "expected": "3848098",
        "comparison": "exact_normalized",
        "currency": "JPY",
        "unit": "JPY_millions",
        "period": "FY2026 (2025-04-01 to 2026-03-31)",
        "basis": "as_reported",
        "case_ids": [
          "FS-070"
        ],
        "receipt_ids": [